{
  "summary": "You can install the Python extension from the Extensions panel.",
  "steps": [
    {
      "step": 1,
      "instruction": "Click Extensions in the left sidebar.",
      "target_text": "Extensions",
      "match": {
        "text": "Extensions",
        "x": 120,
        "y": 450,
        "width": 100,
        "height": 40,
        "confidence": 0.97
      }
    },
    {
      "step": 2,
      "instruction": "Search for Python.",
      "target_text": "Python",
      "match": {
        "text": "Python",
        "x": 300,
        "y": 130,
        "width": 82,
        "height": 28,
        "confidence": 0.93
      }
    }
  ],
  "active_app": {
    "title": "Visual Studio Code",
    "process": "Code.exe",
    "supported": true
  },
  "ocr": {
    "count": 2,
    "items": []
  },
  "screenshot": {
    "path": "tmp/captures/screen-demo.png",
    "width": 1920,
    "height": 1080,
    "screen_width": 1920,
    "screen_height": 1080
  },
  "elapsed_ms": 1800,
  "warnings": []
}
